PT	AU	BA	BE	GP	AF	BF	CA	TI	SO	SE	BS	LA	DT	CT	CY	CL	SP	HO	DE	ID	AB	C1	C3	RP	EM	RI	OI	FU	FP	FX	CR	NR	TC	Z9	U1	U2	PU	PI	PA	SN	EI	BN	J9	JI	PD	PY	VL	IS	PN	SU	SI	MA	BP	EP	AR	DI	DL	D2	EA	PG	WC	WE	SC	GA	PM	OA	HC	HP	DA	UT
J	Kong, M; Liu, QC; Zhou, J; Jiang, LJ; Tian, YM; Yang, J; Ren, S; Li, JL				Kong, Ming; Liu, Qingcai; Zhou, Jian; Jiang, Lijun; Tian, Yuanmeng; Yang, Jian; Ren, Shan; Li, Jiangling			Effect of different potassium species on the deactivation of V2O5-WO3/TiO2 SCR catalyst: Comparison of K2SO4, KCl and K2O	CHEMICAL ENGINEERING JOURNAL												The effect of different potassium species, including K2O, KCl and K2SO4, on the deactivation of V2O5-WO3/TiO2 catalysts were measured in the research. Potassium species were supplied by impregnating catalyst with corresponding KNO3, KCl and K2SO4 aqueous solution. Catalytic activity was also measured and the physical and chemical properties of fresh and poisoned catalysts were characterized by XRD, N-2 physisorption, NH3-TPD, H-2-TPR, XPS and NH3-DRIFTS. Deactivation could be observed in the potassium-containing catalysts and the deactivation rate follows KCl > K2O > K2SO4. The surface chemisorbed oxygen was also reduced and the downward trend was in good accordance with the SCR activity. In addition, both the amount and stability of the Bronsted and Lewis acid sites dropped after potassium introduction, and the reducibility of surface active species decreased. The introduction of SO42- created new Bronsted acid sites and performed advantages to ammonia adsorption and NO reduction. Cl-could react with vanadia active sites to form -O-V-Cl bond, which provided some new ammonia adsorption sites, but these newly generated sites could not revitalize the adsorbed ammonia and were helpless to catalytic activity promotion. Besides, KCl presented the maximum impact on catalyst reducibility was another contribution to its largest activity decline. Finally, the probable poisoning mechanisms of different potassium species over V2O5-WO3/TiO2 catalysts were proposed.					Liu, Qingcai/HHC-3720-2022; Zhou, Jian/AAG-6060-2020	Zhou, Jian/0000-0002-7650-7540; Kong, Ming/0000-0003-2881-034X													1385-8947	1873-3212				SEP 15	2018	348						637	643		10.1016/j.cej.2018.05.045	http://dx.doi.org/10.1016/j.cej.2018.05.045													WOS:000434467000063
J	Drouin, G; Catheline, D; Guillocheau, E; Gueret, P; Baudry, C; Le Ruyet, P; Rioux, V; Legrand, P				Drouin, Gaetan; Catheline, Daniel; Guillocheau, Etienne; Gueret, Pierre; Baudry, Charlotte; Le Ruyet, Pascale; Rioux, Vincent; Legrand, Philippe			Comparative effects of dietary n-3 docosapentaenoic acid (DPA), DHA and EPA on plasma lipid parameters, oxidative status and fatty acid tissue composition	JOURNAL OF NUTRITIONAL BIOCHEMISTRY												The specific and shared physiologic and metabolic effects of eicosapentaenoic acid (EPA), docosahexaenoic acid (DHA) and even more of n-3 docosapentaenoic acid (DPA) are poorly known. We investigated the physiological effects and the overall fatty acid tissue composition of a nutritional supplementation of DPA compared both to EPA and DHA in healthy adult rats. Rats (n=32) were fed with semisynthetic diets supplemented or not with 1% of total lipids as EPA, DPA or DHA in ethyl esters form from weaning for 6 weeks. Fatty acid tissue composition was determined by gas chromatography-mass spectrometry, and blood assays were performed. The DPA supplementation was the only one that led to a decrease in plasma triglycerides, total cholesterol, non-high-density lipoprotein (HDL)-cholesterol, cholesterol esters and total cholesterol/HDL-cholesterol ratio compared to the nonsupplemented control group. The three supplemented groups had increased plasma total antioxidant status and superoxide dismutase activity. In all supplemented groups, the n-3 polyunsaturated fatty acid level increased in all studied tissues (liver, heart, lung, spleen, kidney, red blood cells, splenocytes, peripheral mononucleated cells) except in the brain. We showed that the DPA supplementation affected the overall fatty acid composition and increased DPA, EPA and DHA tissue contents in a similar way than with EPA. However, liver and heart DHA contents increased in DPA-fed rats at the same levels than in DHA-fed rats. Moreover, a large part of DPA seemed to be retroconverted into EPA in the liver (38.5%) and in the kidney (68.6%). In addition, the digestibility of DPA was lower than that of DHA and EPA. (C) 2018 Elsevier Inc. All rights reserved.					Drouin, Gaetan/H-4791-2013; Catheline, Daniel/AAL-7553-2020; Legrand, Philippe/AAM-6060-2020; Rioux, Vincent/AAY-4077-2020; Drouin, Gaetan/A-2661-2019; GUILLOCHEAU, Etienne/N-4491-2018	Drouin, Gaetan/0000-0001-8855-1525; GUILLOCHEAU, Etienne/0000-0002-1617-9936; CATHELINE, Daniel/0000-0002-7143-8216; Legrand, Philippe/0000-0001-5763-4854; Rioux, Vincent/0000-0001-9837-1675													0955-2863	1873-4847				JAN	2019	63						186	196		10.1016/j.jnutbio.2018.09.029	http://dx.doi.org/10.1016/j.jnutbio.2018.09.029								30412907					WOS:000454570000020
J	Sridhar, M; Ferri, D; Elsener, M; van Bokhoven, JA; Kröcher, O				Sridhar, Manasa; Ferri, Davide; Elsener, Martin; van Bokhoven, Jeroen Anton; Kroecher, Oliver			Promotion of Ammonium Formate and Formic Acid Decomposition over Au/TiO2 by Support Basicity under SCR-Relevant Conditions	ACS CATALYSIS												This work demonstrates the rational design of a dedicated hydrolysis catalyst for application in the selective catalytic reduction (SCR) of NOx. Modification of titania by lanthanum prior to gold deposition entailed highly improved catalytic activities for ammonium formate (AmFo) and formic acid decomposition under SCR-relevant conditions stemming from dual phenomena: particle size effect and base effect. Smaller gold particles were stabilized, and there was higher uptake of CO2 and formic acid, as demonstrated by HAADF-STEM and in situ DRIFT analyses, respectively. The difference in the activities between the lanthanum-modified, unmodified, and tungsten-modified catalysts was implicitly dictated by the formic acid coverage, which was in turn greatly increased in the presence of base. In situ DRIFT studies under reaction conditions identified formate as a relevant reaction intermediate, under reaction conditions. Higher E-a,E-app alongside a higher pre-exponential factor (A), describe an underlying compensation effect originating from the contribution of enthalpy associated with the desorption of the strongly adsorbed formate, which is consistent with the highly negative formic acid orders observed in the case of the lanthanum-modified catalysts. Gold is essential to achieve selectivity to CO2; its absence yields CO. The introduction of lanthanum to the catalytic system preferentially promoted the CO2 formation mechanism, enabling complete decomposition of formic acid selectively to CO2 at significantly lower gold loading and lower contact times, making it a promising candidate for decomposition of formate-based ammonia precursors in the SCR process.					Ferri, Davide/KCL-5205-2024; van Bokhoven, Jeroen/B-1677-2014; Kröcher, Oliver/B-2889-2014	Ferri, Davide/0000-0002-9354-5231; Krocher, Oliver/0000-0002-7268-7257													2155-5435					AUG	2015	5	8					4772	4782		10.1021/acscatal.5b01057	http://dx.doi.org/10.1021/acscatal.5b01057													WOS:000359395100033
J	Li, Y; Jiao, YQ; Yan, HJ; Tian, CG; Wu, AP; Fu, HG				Li, Yue; Jiao, Yanqing; Yan, Haijing; Tian, Chungui; Wu, Aiping; Fu, Honggang			Recent progress in synergistic electrocatalysis for generation of valuable products based on water cycle	NANO RESEARCH												Given the grim situation of global warming and energy crisis, replacing traditional energy conversions based on carbon cycle with water cycle is a sustainable development trend. The synergistic electrocatalysis for value-added chemical production through oxygen species (Oads: OH*, 0*, and OOH*) and the active hydrogen species (Hads) derived from water splitting powered by "green" electricity from renewable energy resource (wind, solar, etc.) is a promising manner, because of its reduced energy consumption and emission and high Faradaic efficiency. The study and summarization of catalytic mechanism of synergistic electrocatalysis are particularly significant, but are rarely involved. In this review, recent progress of various synergistic electrocatalysis systems for generating valuable products based on water cycle is systematically summarized. Importantly, the catalytic mechanism of synergistic electrocatalysis and the positive effect of (Dads and Had, species produced by water splitting during the synergistic electrocatalytsis are detailedly elucidated, Furthermore, the regulation of water -derived ()ads and Hads species for achieving efficient matchability of synergistic electrocatalysis is emphatically discussed. Finally, we propose the limitations and future goals of this synergistic system based on water cycle. This review is guidance for design of synergistic electrocatalysis architectures for producing valuable substances based on water cycle.					Fu, Honggang/C-5616-2018; Tian, Chungui/AGB-4516-2022; Jiao, Yan-Qing/C-9158-2015														1998-0124	1998-0000				MAY	2023	16	5					6444	6476		10.1007/s12274-023-5431-6	http://dx.doi.org/10.1007/s12274-023-5431-6		FEB 2023											WOS:000941340900008
J	Zheng, LP; Xia, SX; Lu, XY; Hou, ZY				Zheng, Liping; Xia, Shuixin; Lu, Xiuyang; Hou, Zhaoyin			Transesterification of glycerol with dimethyl carbonate over calcined Ca-Al hydrocalumite	CHINESE JOURNAL OF CATALYSIS												A series of Ca-Al hydrocalumite with different Ca/AI ratios (1-6) were synthesized and used in the transesterification of glycerol with dimethyl carbonate (DMC) to glycerol carbonate (GC) under mild conditions. The calcined Ca-Al hydrocalumites were active with a selectivity toward GC that reached 97% at 93% conversion of glycerol over the sample with Ca/Al = 2 at 70 degrees C, 3 h, and DMC/glycerol = 3. The glycerol conversion depended mainly on the proportion of strong basic sites in the calcined Ca-Al catalysts. The Ca12Al14O33 phase in the calcined catalysts was stable, but CaO was lost in recycle experiments and thus brought deactivation. (C) 2015, Dalian Institute of Chemical Physics, Chinese Academy of Sciences. Published by Elsevier B.V. All rights reserved.					Lu, Chenyang/F-9247-2018; Xia, Shuixin/LFU-4470-2024; Hou, Zhaoyin/D-5756-2014	Hou, Zhaoyin/0000-0002-9687-3863													0253-9837	1872-2067				OCT	2015	36	10					1759	1765		10.1016/s1872-2067(15)60915-9	http://dx.doi.org/10.1016/s1872-2067(15)60915-9													WOS:000362863700015
J	Wu, YW; Zhou, XY; Mi, TG; Hu, B; Liu, J; Lu, Q				Wu, Yang-wen; Zhou, Xin-yue; Mi, Teng-ge; Hu, Bin; Liu, Ji; Lu, Qiang			Effect of WO3 and MoO3 doping on the interaction mechanism between arsenic oxide and V2O5-based SCR catalyst: A theoretical account	MOLECULAR CATALYSIS												WO3 and MoO3 are widely used as the additives for the V2O5-based selective catalytic reduction (SCR) catalysts, which have different anti-arsenic poisoning performances. To clarify their different influence mechanism on the interaction between arsenic oxide (As2O3) and the V2O5-based catalyst, WO3 and MoO3 doped V2O5/TiO2 catalyst models were built, density functional theory (DFT) method was employed to explore the interaction mechanism for As2O3 with V2O5, WO3 and MoO3 from a theoretical level. As2O3 adsorption configurations, adsorption energies and electronic structures were obtained, along with the detailed inter-reaction pathways and relevant energy barriers. The results indicate that strong interaction and electron transfer occur after As2O3 adsorption, the MoO3 doped catalyst has higher reactivity and stronger charge transfer with As2O3 than the WO3 doped catalyst. Moreover, on V2O5-WO3/TiO2 catalyst, the reactivity of WO3 with As2O3 is lower than that of V2O5, hence As2O3 is inclined to react with V2O5, resulting in the catalyst deactivation. Whereas for V2O5-MoO3/TiO2 catalyst, As2O3 tends to react with the more active MoO3, thus protecting the V2O5 from arsenic poisoning. In summary, MoO3 doping provides better anti-arsenic poisoning effect than WO3, which agrees well with previous experimental results.					zhou, xinyue/JOJ-6874-2023; Hu, Bin/HGA-4499-2022; Lu, Qiang/W-5558-2018; Wu, Yang-wen/KBP-8978-2024														2468-8231					JAN	2021	499								111317	10.1016/j.mcat.2020.111317	http://dx.doi.org/10.1016/j.mcat.2020.111317													WOS:000604629700006
J	Shwan, S; Jansson, J; Olsson, L; Skoglundh, M				Shwan, Soran; Jansson, Jonas; Olsson, Louise; Skoglundh, Magnus			Chemical deactivation of H-BEA and Fe-BEA as NH3-SCR catalysts-effect of potassium	APPLIED CATALYSIS B-ENVIRONMENTAL												H-BEA and Fe-BEA were experimentally studied for selective catalytic reduction of NOx using ammonia (NH3-SCR) with a focus on the chemical deactivation caused by potassium exposure where cordierite-supported H-BEA and Fe-BEA samples were exposed to 10 or 50 ppm KNO3 for 14, 24 and 48h in a continuous gas flow reactor at 350 degrees C. The samples were catalytically evaluated and characterized using a flow-reactor system and X-ray photoelectron spectroscopy. The results show that new NOx storage sites are formed on the expense of Bronsted acid sites for ammonia storage for all potassium-exposed samples. The formation of new NOx storage sites results in increased NH3-SCR activity for the potassium-exposed H-BEA samples. However, for the potassium-exposed Fe-BEA samples, the results show a significant decrease in SCR activity. Deconvolution of the Fe 2p(3/2) XPS peak shows a clear increase in the relative amount of Fe3+ for the potassium-exposed Fe-BEA samples, indicating that isolated iron species active for NH3-SCR are exchanged with potassium, forming smaller trivalent iron clusters inside the zeolite pores. Transient experiments during NH3-SCR show that the decrease in ammonia storage capacity due to potassium exposure results in a decreased period with improved NO reduction after NH3 cut-off. (C) 2014 Elsevier B.V. All rights reserved.					; Skoglundh, Magnus/J-2472-2012	Shwan, Soran/0000-0002-5513-2057; Olsson, Louise/0000-0002-8308-0784; Skoglundh, Magnus/0000-0001-7946-7137													0926-3373	1873-3883				MAY	2015	166						277	286		10.1016/j.apcatb.2014.11.042	http://dx.doi.org/10.1016/j.apcatb.2014.11.042													WOS:000348753400031
J	Wu, YW; Zhou, XY; Mi, TG; Xu, MX; Zhao, L; Lu, Q				Wu, Yang-wen; Zhou, Xin-yue; Mi, Teng-ge; Xu, Ming-xin; Zhao, Li; Lu, Qiang			Theoretical insight into the interaction mechanism between V2O5/TiO2 (001) surface and arsenic oxides in flue gas	APPLIED SURFACE SCIENCE					3rd International Conference on Applied Surface Science (ICASS)	JUN 17-19, 2019	Pisa, ITALY					The arsenic oxides in flue gas can cause severe poisoning and deactivation of the vanadium-titanium-based denitrification catalyst. Investigation of the interaction mechanism between arsenic oxides and denitrification catalyst can provide theoretical guidance for the development of anti-arsenic poisoning catalyst. To this end, the periodic V2O5-TiO2 (001) models were constructed to represent the actual vanadium-titanium-based catalyst in this study. Density functional theory (DFT) calculations were applied to explore the interaction mechanism between the catalyst surface and typical arsenic oxide (As2O3) in flue gas. Stable adsorption configurations and adsorption energies for As2O3 and NH3 adsorption were calculated, the detailed interaction pathways and reaction barriers were also obtained. The results indicate that As2O3 is chemisorbed on the catalyst surface, strong interaction and electron transfer occur after As2O3 adsorption. The adsorption strength of NH3 on Lewis and Bronsted sites are decreased after As2O3 adsorption and the inhibition effect on the Lewis acid sites is much stronger. As2O3 is oxidized to As2O5 on catalyst surface, the Lewis acid sites (V = O) are destroyed and the valence of vanadium is decreased, which should be responsible for the catalyst deactivation. The analysis of the interaction pathway shows that As2O3 inclines to react with two adjacent V2O5 clusters to produce V2O4 because of the lowest energy barrier. Therefore, when the catalyst is poisoned by As2O3 in flue gas, the active component V2O5 inclines to generate V2O4, which is consistent with previous experimental researches.					zhou, xinyue/JOJ-6874-2023; Wu, Yang-wen/KBP-8978-2024; Lu, Qiang/W-5558-2018	XU, Mingxin/0000-0003-1563-9846													0169-4332	1873-5584				JAN 1	2021	535								147752	10.1016/j.apsusc.2020.147752	http://dx.doi.org/10.1016/j.apsusc.2020.147752													WOS:000582373900076
J	Simic, Z; Weiwad, M; Schierhorn, A; Steegborn, C; Schutkowski, M				Simic, Zeljko; Weiwad, Matthias; Schierhorn, Angelika; Steegborn, Clemens; Schutkowski, Mike			The -Amino Group of Protein Lysine Residues Is Highly Susceptible to Nonenzymatic Acylation by Several Physiological Acyl-CoA Thioesters	CHEMBIOCHEM												Mitochondrial enzymes implicated in the pathophysiology of diabetes, cancer, and metabolic syndrome are highly regulated by acetylation. However, mitochondrial acetyltransferases have not been identified. Here, we show that acetylation and also other acylations are spontaneous processes that depend on pH value, acyl-CoA concentration and the chemical nature of the acyl residue. In the case of a peptide derived from carbamoyl phosphate synthetase1, the rates of succinylation and glutarylation were up to 150 times than for acetylation. These results were confirmed by using the protein substrate cyclophilinA (CypA). Deacylation experiments revealed that SIRT3 exhibits deacetylase activity but is not able to remove any of the succinyl groups from CypA, whereas SIRT5 is an effective protein desuccinylase. Thus, the acylation landscape on lysine residues might largely depend on the enzymatic activity of specific sirtuins, and the availability and reactivity of acyl-CoA compounds.					Staels, Bart/N-9497-2016	Schutkowski, MIke/0000-0003-0919-7076													1439-4227	1439-7633				NOV 2	2015	16	16					2337	2347		10.1002/cbic.201500364	http://dx.doi.org/10.1002/cbic.201500364								26382620					WOS:000363422200011
J	Lu, SJ; Lin, JY; Wang, CH; Zhang, YF; Zhang, Y; Fan, HS				Lu, Sheng-Jun; Lin, Jin-Yi; Wang, Cai-Hong; Zhang, Yu-Fei; Zhang, Yi; Fan, Hao-Sen			Heterogeneous engineering of MnSe@NC@ReS2 core-shell nanowires for advanced sodium-/potassium-ion batteries	RARE METALS												Sodium-ion batteries (SIBs) and potassium-ion batteries (PIBs) have been attracting great attentions and widely been exploited due to the abundant sodium/potassium resources. Hence, the preparation of high-powered anode materials for SIBs/PIBs plays a decisive role for the commercial applications of SIBs/PIBs in the future. Manganese selenides are a class of potential anode materials for SIBs/PIBs because of their small band gap and high electrical conductivity. In this work, MnSe and ReS2 core-shell nanowires connecting by polydopamine derived carbon nanotube (MnSe@NC@ReS2) have been successfully synthesized from growing ReS2 nanosheets array on the surface of MnSe@NC nanowires, which present excellent Na+/K+ storage performance. While applied as SIBs anode, the specific capacity of 300 mAh<middle dot>g(-1) was maintained after 400 cycles at the current density of 1.0 A<middle dot>g(-1). Besides, it could also keep 120 mAh<middle dot>g(-1) specific capacity after 900 cycles at 1.0 A<middle dot>g(-1) for the anode of PIBs. These heterogeneous engineering and one-dimensional-two-dimensional (1D-2D) hybrid strategies could provide an ideal strategy for the synthesis of new hetero-structured anode materials with outstanding battery performance for SIBs and PIBs.					Zhang, Yi/AEU-1308-2022	FAN, HAOSEN/0000-0003-4323-8927													1001-0521	1867-7185				AUG	2024	43	8					3713	3723		10.1007/s12598-024-02650-8	http://dx.doi.org/10.1007/s12598-024-02650-8		MAY 2024											WOS:001216985200004
J	Mennella, MRF				Mennella, Maria Rosaria Faraone			A new facet of ADP-ribosylation reactions: SIRTs and PARPs interplay	FRONTIERS IN BIOSCIENCE-LANDMARK												Nicotinamide Adenine Dinucleotide (NAD(+)) is known mainly as coenzyme of redox reactions for energy transduction and is consumed as substrate in regulatory reactions removing nicotinamide and producing ADP-ribose. Several families of ADPribose synthesizing enzymes use NAD(+) as substrate and control processes like DNA repair, replication and transcription, chromatin structure, the activity of G-proteins and others. Since NAD(+)-dependent reactions involve degradation of the dinucleotide, a constant supply of the pyridinic substrate is required for its homeostasis. NAD(+)-dependent signaling reactions include protein deacetylation by sirtuins, intracellular calcium signaling and mono-/poly-ADP-ribosylation. In the context of all NAD(+)-dependent reactions leading to ADP-ribose synthesis, this review focuses mainly on both the central role played by sirtuins and poly-ADPribose polymerases as cellular NAD(+) consumers and their crosstalk in signaling pathways.						faraone mennella, maria rosaria/0000-0003-1947-4700													1093-9946	1093-4715				JAN 1	2015	20						458	473		10.2741/4319	http://dx.doi.org/10.2741/4319								25553461					WOS:000354353700004
J	Tarasenko, TN; McGuire, PJ				Tarasenko, Tatyana N.; McGuire, Peter J.			The liver is a metabolic and immunologic organ: A reconsideration of metabolic decompensation due to infection in inborn errors of metabolism (IEM)	MOLECULAR GENETICS AND METABOLISM												Metabolic decompensation in inborn errors of metabolism (IEM) is characterized by a rapid deterioration in metabolic status leading to life-threatening biochemical perturbations (e.g. hypoglycemia, hyperammonemia, acidosis, organ failure). Infection is the major cause of metabolic decompensation in patients with IEM. We hypothesized that activation of the immune system during infection leads to further perturbations in end organ metabolism resulting in increased morbidity. To address this, we established model systems of metabolic decompensation due to infection. Using these systems, we have described the pathologic mechanisms of metabolic decompensation as well as changes in hepatic metabolic reserve associated with infection. First and foremost, our studies have demonstrated that the liver experiences a significant local innate immune response during influenza infection that modulates hepatic metabolism. Based on these findings, we are the first to suggest that the role of the liver as a metabolic and immunologic organ is central in the pathophysiology of metabolic de compensation due to infection in IEM. The dual function of the liver as a major metabolic regulator and a lymphoid organ responsible for immunosurveillance places this organ at risk for hepatotoxicity. Mobilization of hepatic reserve and the regenerative capacity of a healthy liver compensates for this calculated risk. However, activation of the hepatic innate immune system may be deleterious in IEM. Based on this assertion, strategies aimed at modulating the innate immune response may be a viable target for intervention in the treatment of hepatic metabolic decompensation. Published by Elsevier Inc.																			1096-7192	1096-7206				AUG	2017	121	4					283	288		10.1016/j.ymgme.2017.06.010	http://dx.doi.org/10.1016/j.ymgme.2017.06.010								28666653					WOS:000407530600001
J	Zhang, L; Yao, WL; Xia, J; Wang, TX; Huang, FR				Zhang, Li; Yao, Weilei; Xia, Jun; Wang, Tongxin; Huang, Feiruo			Glucagon-Induced Acetylation of Energy-Sensing Factors in Control of Hepatic Metabolism	INTERNATIONAL JOURNAL OF MOLECULAR SCIENCES												The liver is the central organ of glycolipid metabolism, which regulates the metabolism of lipids and glucose to maintain energy homeostasis upon alterations of physiological conditions. Researchers formerly focused on the phosphorylation of glucagon in controlling liver metabolism. Noteworthily, emerging evidence has shown glucagon could additionally induce acetylation to control hepatic metabolism in response to different physiological states. Through inducing acetylation of complex metabolic networks, glucagon interacts extensively with various energy-sensing factors in shifting from glucose metabolism to lipid metabolism during prolonged fasting. In addition, glucagon-induced acetylation of different energy-sensing factors is involved in the advancement of nonalcoholic fatty liver disease (NAFLD) to liver cancer. Here, we summarize the latest findings on glucagon to control hepatic metabolism by inducing acetylation of energy-sensing factors. Finally, we summarize and discuss the potential impact of glucagon on the treatment of liver diseases.					xia, jun/ABG-4188-2020	Zhang, Li/0000-0001-8718-0216														1422-0067				APR 2	2019	20	8							1885	10.3390/ijms20081885	http://dx.doi.org/10.3390/ijms20081885								30995792					WOS:000467648700083
